{
  "$schema": "./requirement-exclusions.schema.json",
  "description": "E2Eテスト対象外の受入基準とその代替検証方法を定義。除外は被覆率の分母から条文を外す宣言であるため、実装が無く実装するかどうかも未決の条文は登録しない——確かめる対象が存在しない条文を分母から外すと「E2E対象外」という偽の宣言になる。未被覆のまま列挙されることが未実装・未決の正直な表現である（タスク115.258 の決着とタスク115.314 の判断。判断の全文は .kiro/specs/site-survey/design.md にある）",
  "version": "1.0.0",
  "lastUpdated": "2026-10-01",
  "exclusions": [
    {
      "id": "REQ-23.3",
      "requirement": "REQ-23: 非機能要件（パフォーマンス・スケーラビリティ）",
      "title": "レスポンスタイム要件",
      "criterionText": "WHEN システムが大量の同時ユーザーを処理する THEN Authentication Serviceはレスポンスタイムの劣化率を20%以内に抑えなければならない",
      "reason": "パフォーマンステストはE2Eテストの範囲外。負荷テストツールで検証が必要",
      "category": "performance",
      "alternativeVerification": {
        "method": "load-test",
        "tool": "k6 / Artillery / JMeter",
        "description": "同時1000ユーザー負荷時のp95レスポンスタイムを計測し、低負荷時の基線に対する劣化率が20%以内であることを判定する",
        "threshold": "p95 < 500ms かつ degradation_rate <= 20%"
      }
    },
    {
      "id": "REQ-23.4",
      "requirement": "REQ-23: 非機能要件（パフォーマンス・スケーラビリティ）",
      "title": "キャッシュヒット率要件",
      "criterionText": "WHEN 権限情報がキャッシュされる THEN Authentication Serviceは90%以上のキャッシュヒット率を維持しなければならない",
      "reason": "Redis統計情報の継続的監視が必要。単発E2Eテストでは検証不可",
      "category": "performance",
      "alternativeVerification": {
        "method": "monitoring",
        "tool": "Redis INFO / Prometheus / Grafana",
        "description": "本番環境でキャッシュヒット率を継続監視",
        "threshold": "cache_hit_rate >= 90%"
      }
    },
    {
      "id": "REQ-23.5",
      "requirement": "REQ-23: 非機能要件（パフォーマンス・スケーラビリティ）",
      "title": "データベース接続プール管理",
      "criterionText": "WHEN データベース接続プールを管理する THEN Authentication Serviceは10-50接続の接続プールサイズを維持しなければならない",
      "reason": "接続プール設定はインフラ構成。テストではなく設定レビューで検証",
      "category": "infrastructure",
      "alternativeVerification": {
        "method": "config-review",
        "tool": "Prisma config / Railway Dashboard",
        "description": "接続プール設定（10-50接続）を設定ファイルとインフラ設定で確認",
        "threshold": "pool_size: 10-50"
      }
    },
    {
      "id": "REQ-23.7",
      "requirement": "REQ-23: 非機能要件（パフォーマンス・スケーラビリティ）",
      "title": "水平スケーリング対応",
      "criterionText": "WHEN システムが水平スケーリングされる THEN Authentication Serviceはステートレス設計により、複数インスタンス間でセッション共有を可能にしなければならない",
      "reason": "複数インスタンス環境のテストはE2E範囲外。アーキテクチャレビューで検証",
      "category": "infrastructure",
      "alternativeVerification": {
        "method": "architecture-review",
        "tool": "Code Review / ADR",
        "description": "ステートレス設計の確認（セッション管理はRedis、JWT使用等）",
        "threshold": "stateless_design: true"
      }
    },
    {
      "id": "REQ-24.1",
      "requirement": "REQ-24: フォールトトレランス（障害耐性）",
      "title": "データベース接続タイムアウト時の503エラー",
      "criterionText": "IF データベース接続がタイムアウト以内に確立できない THEN Authentication Serviceは503 Service Unavailableエラーを返さなければならない",
      "reason": "E2E は共有の backend・DB に対して走り、DB への接続の確立だけを無応答にする手段を持たないためE2E範囲外。代替検証は従前カオスエンジニアリング（Docker network disconnect / Toxiproxy）を掲げていたがリポジトリに実体が無く、タスク36.5 で実在する統合検証（タスク35.11〜35.13・36.3 で追加）へ改めた",
      "category": "fault-tolerance",
      "alternativeVerification": {
        "method": "integration-test",
        "tool": "Vitest / Supertest",
        "description": "TCP 接続を受け付けるが一切応答しないローカルのサーバーを DATABASE_URL の接続先にして本物のアプリ（getPrismaClient・RetryingPool・errorHandler）を通し、認証系の実エンドポイントが 503 と Problem Details を返すことを主張する: backend/src/__tests__/integration/auth-db-connection-timeout-503.integration.test.ts（ログイン・現在のユーザーの取得・トークンの更新・ログアウトほか）、authorize-db-connection-timeout-503.integration.test.ts（権限の確認を通るエンドポイント。権限のキャッシュに当たる場合と当たらない場合）、auth-transaction-db-connection-timeout-503.integration.test.ts（対話型トランザクションの開始の打ち切り）、password-two-factor-db-connection-timeout-503.integration.test.ts と password-two-factor-transaction-db-connection-timeout-503.integration.test.ts（パスワードと二要素認証。実データベースへの TCP の中継で無応答を切り替える）。いずれも同じディレクトリにあり、各テストが @requirement user-authentication/REQ-24.1 を名乗る",
        "threshold": "http_status: 503"
      }
    },
    {
      "id": "REQ-24.2",
      "requirement": "REQ-24: フォールトトレランス（障害耐性）",
      "title": "キャッシュ障害時のフォールバック",
      "criterionText": "IF キャッシュ接続が失敗する THEN Authentication Serviceはデータベースから直接権限情報を取得しなければならない",
      "reason": "E2E は共有の backend・Redis に対して走り、実行中の backend の Redis の接続だけを落とす手段を持たないためE2E範囲外。代替検証は従前カオスエンジニアリング（Docker stop redis / Toxiproxy）を掲げていたがリポジトリに実体が無く、タスク36.5 で実在する統合検証（タスク36.2 で追加。本番の requirePermission が Redis を持つ共有の RBACService を使うようになった後の経路）へ改めた",
      "category": "fault-tolerance",
      "alternativeVerification": {
        "method": "integration-test",
        "tool": "Vitest / Supertest",
        "description": "backend/src/__tests__/integration/rbac-permission-cache.integration.test.ts の \"Redis の接続が失われているとき、権限を DB から取得して応答し、err 付きの警告ログを残す\" が、実 Redis・実 DB・本物の requirePermission の経路で、キャッシュに「権限なし」を置いたうえでアプリが使う本物の Redis クライアントを切断し（status が end）、DB の権限で 200 が返ること（キャッシュを読めば 403 になる状態からの許可）と、障害中にキャッシュを書き換えないことを主張する（@requirement user-authentication/REQ-24.2）",
        "threshold": "fallback_to_db: true"
      }
    },
    {
      "id": "REQ-24.9",
      "requirement": "REQ-24: フォールトトレランス（障害耐性）",
      "title": "ヘルスチェックエンドポイント",
      "criterionText": "WHEN サービスが部分的な障害から復旧する THEN Authentication Serviceはヘルスチェックエンドポイントで障害状態を報告しなければならない",
      "reason": "部分障害からの復旧検証はE2E範囲外。ヘルスチェックの存在はAPIテストで確認済み",
      "category": "fault-tolerance",
      "alternativeVerification": {
        "method": "api-test",
        "tool": "curl / httpie",
        "description": "部分的な障害から復旧する際に /health エンドポイントが障害状態を報告することを確認",
        "threshold": "http_status: 200, degraded_state: reported"
      }
    },
    {
      "id": "REQ-26.3",
      "requirement": "REQ-26: セキュリティ対策（脅威モデリング）",
      "title": "CSRFトークン検証",
      "criterionText": "WHEN 状態を変更するAPIリクエストが送信される THEN Authentication ServiceはCSRFトークンを検証しなければならない",
      "reason": "テスト環境ではCSRF保護が無効化されている。本番環境でのセキュリティ監査で検証",
      "category": "security",
      "alternativeVerification": {
        "method": "security-audit",
        "tool": "OWASP ZAP / Burp Suite",
        "description": "本番環境でCSRFトークンが必須であることをセキュリティスキャンで確認",
        "threshold": "csrf_protection: enabled"
      }
    },
    {
      "id": "REQ-26.8",
      "requirement": "REQ-26: セキュリティ対策（脅威モデリング）",
      "title": "パスワードリセットトークンの暗号学的安全性",
      "criterionText": "WHEN パスワードリセットトークンを生成する THEN Authentication Serviceは暗号学的に安全な乱数生成器を使用しなければならない",
      "reason": "トークン生成アルゴリズムの検証はコードレビュー範囲。E2Eでは検証不可",
      "category": "security",
      "alternativeVerification": {
        "method": "code-review",
        "tool": "Manual review / Static analysis",
        "description": "crypto.randomBytes(32)使用によるトークン生成を確認",
        "threshold": "entropy_bits: >= 256"
      }
    },
    {
      "id": "REQ-23.1",
      "requirement": "REQ-23: 非機能要件（パフォーマンス・スケーラビリティ）",
      "title": "ログインAPIレスポンスタイム",
      "criterionText": "WHEN ログインAPIリクエストが送信される THEN Authentication Serviceは95パーセンタイルで500ms以内にレスポンスを返さなければならない",
      "reason": "APIレスポンスタイムの計測は負荷テストで検証",
      "category": "performance",
      "alternativeVerification": {
        "method": "load-test",
        "tool": "k6 / Artillery",
        "description": "ログインAPIの応答時間を計測",
        "threshold": "p95 < 200ms"
      }
    },
    {
      "id": "REQ-23.2",
      "requirement": "REQ-23: 非機能要件（パフォーマンス・スケーラビリティ）",
      "title": "権限チェックAPIレスポンスタイム",
      "criterionText": "WHEN 権限チェックAPIが呼び出される THEN Authentication Serviceは99パーセンタイルで100ms以内にレスポンスを返さなければならない",
      "reason": "APIレスポンスタイムの計測は負荷テストで検証",
      "category": "performance",
      "alternativeVerification": {
        "method": "load-test",
        "tool": "k6 / Artillery",
        "description": "権限チェックAPIの応答時間を計測し、99パーセンタイルが100ms以内であることを判定する",
        "threshold": "p99 <= 100ms"
      }
    },
    {
      "id": "REQ-23.6",
      "requirement": "REQ-23: 非機能要件（パフォーマンス・スケーラビリティ）",
      "title": "トークンリフレッシュAPIレスポンスタイム",
      "criterionText": "WHEN トークンリフレッシュAPIが呼び出される THEN Authentication Serviceは95パーセンタイルで300ms以内にレスポンスを返さなければならない",
      "reason": "APIレスポンスタイムの計測は負荷テストで検証",
      "category": "performance",
      "alternativeVerification": {
        "method": "load-test",
        "tool": "k6 / Artillery",
        "description": "トークンリフレッシュAPIの応答時間を計測",
        "threshold": "p95 < 200ms"
      }
    },
    {
      "id": "REQ-23.8",
      "requirement": "REQ-23: 非機能要件（パフォーマンス・スケーラビリティ）",
      "title": "データベースクエリインデックス最適化",
      "criterionText": "WHEN データベースクエリを実行する THEN Authentication Serviceは適切なインデックスを使用して、クエリ時間を最小限に維持しなければならない",
      "reason": "データベースインデックスの検証はコードレビューとクエリ分析で検証",
      "category": "performance",
      "alternativeVerification": {
        "method": "code-review",
        "tool": "Prisma Schema / EXPLAIN ANALYZE",
        "description": "頻繁に実行されるクエリに適切なインデックスが設定されていること、および EXPLAIN ANALYZE でクエリ時間が最小限に保たれていることを確認",
        "threshold": "index_coverage: appropriate"
      }
    },
    {
      "id": "project-management/REQ-19.4",
      "requirement": "REQ-19: パフォーマンス",
      "title": "検索・フィルタリング操作の結果表示",
      "criterionText": "The ArchiTrackシステム shall 検索・フィルタリング操作の結果表示を標準的な使用条件下で1秒以内に完了する",
      "reason": "パフォーマンス計測はE2E範囲外。負荷テストで検証",
      "category": "performance",
      "alternativeVerification": {
        "method": "load-test",
        "tool": "k6 / Lighthouse",
        "description": "検索・フィルタリング操作の結果表示を1秒以内に完了することを確認",
        "threshold": "search_result < 1s"
      }
    },
    {
      "id": "project-management/REQ-19.5",
      "requirement": "REQ-19: パフォーマンス",
      "title": "大量データ時のページネーション性能",
      "criterionText": "The ArchiTrackシステム shall 大量データでもページネーションにより一覧表示のパフォーマンスを維持する",
      "reason": "大量データのパフォーマンス検証はE2E範囲外。負荷テストで検証",
      "category": "performance",
      "alternativeVerification": {
        "method": "load-test",
        "tool": "k6 / Artillery",
        "description": "大量データ（1000件以上）でもページネーションにより一覧表示のパフォーマンスが維持されることを確認",
        "threshold": "pagination_load < 2s"
      }
    },
    {
      "id": "site-survey/REQ-9.4",
      "requirement": "REQ-9: 注釈データの保存・復元",
      "title": "保存中インジケーター表示",